{
  "$schema": "http://json-schema.org/draft-07/schema#",
  "$id": "https://github.com/JrSneed28/TwinHarness/schemas/brief.schema.json",
  "title": "TwinHarness tier brief.json",
  "description": "Input to the Tier-0 classifier (th tier classify|veto-check). Mirrors the hand-rolled validator in src/core/brief.ts (kept in sync by tests/schemas.test.ts).",
  "type": "object",
  "additionalProperties": false,
  "required": [
    "single_file_or_local",
    "changes_public_interface",
    "adds_dependency",
    "obvious_testable_answer",
    "blast_radius_flags"
  ],
  "properties": {
    "description": { "type": "string" },
    "single_file_or_local": { "type": "boolean", "description": "Touches a single file / tightly local area." },
    "changes_public_interface": { "type": "boolean", "description": "Changes a public interface / schema / contract." },
    "adds_dependency": { "type": "boolean", "description": "Adds a new dependency." },
    "obvious_testable_answer": { "type": "boolean", "description": "Has an obvious, testable correct answer." },
    "blast_radius_flags": {
      "type": "array",
      "items": {
        "type": "string",
        "enum": ["authentication", "authorization", "data-integrity", "money", "migrations"]
      }
    }
  }
}
